[
  {
    "center": "Naripayur",
    "childNumber": "BET-BJJ/225",
    "classOfStudy": "4 Standard",
    "dateOfBirth": "09 Oct 1996",
    "gender": "Female",
    "id": "232bc4abb5924f129c6dce8f9f6bb776",
    "name": "Bala Devi",
    "rawText": "BETHEL AGRICULTUER\nNo.1/D2 8t. Thomas Road, Ma|\nTirunelvell District, Tan{}\nHILD INTRODU\n1 Name : Bala Devi [\n2 Child Number § BET-BLL/225\n3 Sex - Female\n4 Date of Birth : 09.10.1996\n5§ Country of Residence § India\n6 Year of admission : 2004\n7 Class of study 3 IV Standard\n8 Name of Home : FKC Naripaiyur\n9 Famlly details\nSl.lNo. Name Age Relationshi|\n1 Karuppasamy 53 Father Sick\n2 \\Valli 45 Mother Wood cutter\n3 Rajeswaran 25 Elder brother Married\n4 Paramasivan 23 Elder brother Married\n5 Jegatheeswari 22 Elder sister Married\n8 Umayeswari 15 Elder sister At home\n7 Karthick 13 Elder brother Works as an assistant\nin a shop\nCase history:\nThe father of the child is a sickly man unable to do any work. The illiterate mother eamns\nwhat she can which is barely enough to feed them. The family lives in poverty.\nel o\nDate: For Bethel Agricultural Fellowship",
    "yearOfAdmission": "2004"
  },
  {
    "center": "Naripayur",
    "childNumber": "BET-BLL/104",
    "classOfStudy": "4 Standard",
    "dateOfBirth": "15 Feb 1998",
    "gender": "Male",
    "id": "c6055b5685c24b3dbdf2dd5dfb495bf8",
    "name": "T. Selva Ganesh",
    "rawText": "g\nsmm—m. R\nBETHEL AGRICULTURAL FELLOWSHIP\nNo.1/D2 8t. Thomas Road, Mal\nTirunelvell District, Tam)\nCHILD INTRODUC\nName T. Selva Ganesh\nChild Number : BET-BLL/104\nSex : Male\nDate of Birth : 15.02.1998\nCountry of Residence : India\nYear of admission 2 2005\nClass of study % IV Standard\nName of Home . FKC Naripayur\nMO\nFamily details\n1 Thangapandi 43 Father Palmyrah tapper\n2 Annakodi 38 Mother Housewife\n3 Marimuthu 14 Elder Brother Studying IX Standard\n4 Ramkumar 10 Elder Brother Studying VI Standard\n5 Navaneetha Mari Kannan 7 Younger Brother Studying |l Standard\nCase history:\nThe child's father is a palmyrah tapper. The juice of the tall palmyrah tree is tapped and sold\nto make country liquor and sugar. The work is seasonal and the income low and inadequate.\nThe father does not get adequate work when it is out of season. The family starves most of\nthe days.\nThe rate of literace in the village is very low. Due to poverty, the villagers do not give importance\nto the education of their children. They send their children to work as labourers for mean wages\nat salt-pan or elsewhere, to help increase the income of the family.\nThe child was admitted to the Bethel Centre to save him from poverty, child labour and give him\na good future.\nLl Koo\nDate: For Bethel Agricultural Fellowship",
    "yearOfAdmission": "2005"
  },
  {
    "center": "Pudur",
    "childNumber": "BET-BJJ/141",
    "classOfStudy": "VIl Standard",
    "dateOfBirth": "26 Apr 1994",
    "gender": "Male",
    "id": "415e3ec8a0834d4c96996738da4fca5f",
    "name": "Narayana Perumal",
    "rawText": "@ BETHEL AGRICULTURAL FELLOWSHIP\nNo.1/D2 St. Thomas Road, Maha\nTirunelvell District, Tamll\nCHILD INTRODUCTIQ\n1 Name : Narayana Perumal\n2 Child Number : BET-BJJ/141\n3 Sex 3 Male\n4 Date of Birth ; 26.04.1994\n5 Country of Residence s India\n6 Year of admission y 2002\n7 Class of study : VIl Standard\n8 Name of Home A FKC K.C. Pudur\nFamily details\nSi.No. Name Relationship\n1 Vaikuntam 34 Father Paimyrah Tree climber f\n2 Muthukani 31 Mother Housewife\n3 Suganya 10 Younger Sister Studying V Standard\n4 Poonkodi 7 Younger Sister Studying lil Standard\n5 Sumitha 4 Younger Sister\n_—— s - - -re————.—\nCase history:\nThe father is a palmyrah tree tapper. The work provides seasonal and insufficient income.\nThe family suffers much due to poverty and disease.\nel Kee\nDate: For Bethel Agricultural Fellowship",
    "yearOfAdmission": "2002"
  }
]